{
  "contract_version": "1.0.0",
  "activation_mode": "ACTIVE_CORE_ADMISSION",
  "measurement_registry_version": "1.0.0",
  "score_anchor_source": "assets/measurement-registry.json#metric_score_scale",
  "metrics": [
    {
      "metric_id": "FIND-01",
      "category": "findability_seo",
      "metric_weight": 10,
      "category_weight": 25,
      "score_mode": "binary_or_graded",
      "allowed_score_statuses": [
        "strong",
        "minor_gaps",
        "mixed",
        "weak",
        "blocking"
      ],
      "threshold_source_required": false,
      "defined_test_method": "Fetch canonical public URL and record status/final URL.",
      "capability_id": "public_http_fetch",
      "source_family": "PUBLIC_DETERMINISTIC_TECHNICAL",
      "accepted_source_families": [
        "PUBLIC_DETERMINISTIC_TECHNICAL",
        "MEASUREMENT_GATEWAY"
      ],
      "required_evidence": {
        "scoreable_execution_states": [
          "MEASURED",
          "OBSERVED"
        ],
        "minimum_evidence_refs": 1,
        "missing_evidence_behavior": "NOT_SCORE_ADMITTED"
      },
      "maximum_evidence_grade": "E4",
      "expected_value_type": "object",
      "target_binding_policy": "SAME_AUDIT_TARGET",
      "normalization_path": "CORE_EXECUTION_BUNDLE_V1_TO_DIAGNOSIS_METRIC",
      "score_admission_requirements": [
        "AUTHORIZED_METRIC_ID",
        "SAME_AUDIT_TARGET",
        "SUCCESSFUL_EXECUTION_STATE",
        "EVIDENCE_REFERENCE_PRESENT",
        "EVIDENCE_GRADE_ALLOWED",
        "VALUE_TYPE_MATCH",
        "METHOD_PRESENT",
        "LIMITATION_PRESENT",
        "AUTHORIZED_CONTROL_BASIS",
        "AUTHORIZED_PRODUCT_STATUS",
        "AUTHORIZED_SCORE_ANCHOR",
        "THRESHOLD_SOURCE_WHEN_REQUIRED",
        "NO_CONFLICTING_EVIDENCE",
        "NO_RAW_PROVIDER_PAYLOAD"
      ],
      "non_execution_reason_codes": [
        "EVIDENCE_UNAVAILABLE",
        "EXECUTION_ERROR",
        "EVIDENCE_CONFLICT",
        "TARGET_MISMATCH",
        "NOT_APPLICABLE",
        "THRESHOLD_SOURCE_MISSING",
        "EVIDENCE_GRADE_TOO_WEAK",
        "VALUE_TYPE_INVALID",
        "RAW_PROVIDER_EVIDENCE_REJECTED"
      ],
      "control_basis": "PUBLIC_REPRODUCIBLE"
    },
    {
      "metric_id": "FIND-02",
      "category": "findability_seo",
      "metric_weight": 10,
      "category_weight": 25,
      "score_mode": "binary_or_graded",
      "allowed_score_statuses": [
        "strong",
        "minor_gaps",
        "mixed",
        "weak",
        "blocking"
      ],
      "threshold_source_required": false,
      "defined_test_method": "Fetch robots.txt and sitemap locations when public.",
      "capability_id": "public_http_fetch",
      "source_family": "PUBLIC_DETERMINISTIC_TECHNICAL",
      "accepted_source_families": [
        "PUBLIC_DETERMINISTIC_TECHNICAL",
        "MEASUREMENT_GATEWAY"
      ],
      "required_evidence": {
        "scoreable_execution_states": [
          "MEASURED",
          "OBSERVED"
        ],
        "minimum_evidence_refs": 1,
        "missing_evidence_behavior": "NOT_SCORE_ADMITTED"
      },
      "maximum_evidence_grade": "E4",
      "expected_value_type": "object",
      "target_binding_policy": "SAME_AUDIT_TARGET",
      "normalization_path": "CORE_EXECUTION_BUNDLE_V1_TO_DIAGNOSIS_METRIC",
      "score_admission_requirements": [
        "AUTHORIZED_METRIC_ID",
        "SAME_AUDIT_TARGET",
        "SUCCESSFUL_EXECUTION_STATE",
        "EVIDENCE_REFERENCE_PRESENT",
        "EVIDENCE_GRADE_ALLOWED",
        "VALUE_TYPE_MATCH",
        "METHOD_PRESENT",
        "LIMITATION_PRESENT",
        "AUTHORIZED_CONTROL_BASIS",
        "AUTHORIZED_PRODUCT_STATUS",
        "AUTHORIZED_SCORE_ANCHOR",
        "THRESHOLD_SOURCE_WHEN_REQUIRED",
        "NO_CONFLICTING_EVIDENCE",
        "NO_RAW_PROVIDER_PAYLOAD"
      ],
      "non_execution_reason_codes": [
        "EVIDENCE_UNAVAILABLE",
        "EXECUTION_ERROR",
        "EVIDENCE_CONFLICT",
        "TARGET_MISMATCH",
        "NOT_APPLICABLE",
        "THRESHOLD_SOURCE_MISSING",
        "EVIDENCE_GRADE_TOO_WEAK",
        "VALUE_TYPE_INVALID",
        "RAW_PROVIDER_EVIDENCE_REJECTED"
      ],
      "control_basis": "PUBLIC_REPRODUCIBLE"
    },
    {
      "metric_id": "FIND-03",
      "category": "findability_seo",
      "metric_weight": 10,
      "category_weight": 25,
      "score_mode": "binary_or_graded",
      "allowed_score_statuses": [
        "strong",
        "minor_gaps",
        "mixed",
        "weak",
        "blocking"
      ],
      "threshold_source_required": false,
      "defined_test_method": "Inspect index directives, canonical tags and redirect behavior on sampled templates.",
      "capability_id": "html_inspection",
      "source_family": "STRUCTURED_CONTENT_DOM_METADATA",
      "accepted_source_families": [
        "STRUCTURED_CONTENT_DOM_METADATA",
        "RULE_BASED_QUALITATIVE_OBSERVATION"
      ],
      "required_evidence": {
        "scoreable_execution_states": [
          "OBSERVED"
        ],
        "minimum_evidence_refs": 1,
        "missing_evidence_behavior": "NOT_SCORE_ADMITTED"
      },
      "maximum_evidence_grade": "E4",
      "expected_value_type": "object",
      "target_binding_policy": "SAME_AUDIT_TARGET",
      "normalization_path": "CORE_EXECUTION_BUNDLE_V1_TO_DIAGNOSIS_METRIC",
      "score_admission_requirements": [
        "AUTHORIZED_METRIC_ID",
        "SAME_AUDIT_TARGET",
        "SUCCESSFUL_EXECUTION_STATE",
        "EVIDENCE_REFERENCE_PRESENT",
        "EVIDENCE_GRADE_ALLOWED",
        "VALUE_TYPE_MATCH",
        "METHOD_PRESENT",
        "LIMITATION_PRESENT",
        "AUTHORIZED_CONTROL_BASIS",
        "AUTHORIZED_PRODUCT_STATUS",
        "AUTHORIZED_SCORE_ANCHOR",
        "THRESHOLD_SOURCE_WHEN_REQUIRED",
        "NO_CONFLICTING_EVIDENCE",
        "NO_RAW_PROVIDER_PAYLOAD"
      ],
      "non_execution_reason_codes": [
        "EVIDENCE_UNAVAILABLE",
        "EXECUTION_ERROR",
        "EVIDENCE_CONFLICT",
        "TARGET_MISMATCH",
        "NOT_APPLICABLE",
        "THRESHOLD_SOURCE_MISSING",
        "EVIDENCE_GRADE_TOO_WEAK",
        "VALUE_TYPE_INVALID",
        "RAW_PROVIDER_EVIDENCE_REJECTED"
      ],
      "control_basis": "PUBLIC_REPRODUCIBLE"
    },
    {
      "metric_id": "FIND-04",
      "category": "findability_seo",
      "metric_weight": 10,
      "category_weight": 25,
      "score_mode": "search_sample",
      "allowed_score_statuses": [
        "strong",
        "minor_gaps",
        "mixed",
        "weak",
        "blocking"
      ],
      "threshold_source_required": false,
      "defined_test_method": "Run dated brand query and record visible result/snippet evidence.",
      "capability_id": "search_sample",
      "source_family": "SEARCH_INDEXING_SERP",
      "accepted_source_families": [
        "SEARCH_INDEXING_SERP"
      ],
      "required_evidence": {
        "scoreable_execution_states": [
          "OBSERVED"
        ],
        "minimum_evidence_refs": 1,
        "missing_evidence_behavior": "NOT_SCORE_ADMITTED"
      },
      "maximum_evidence_grade": "E5",
      "expected_value_type": "object",
      "target_binding_policy": "SAME_AUDIT_TARGET",
      "normalization_path": "CORE_EXECUTION_BUNDLE_V1_TO_DIAGNOSIS_METRIC",
      "score_admission_requirements": [
        "AUTHORIZED_METRIC_ID",
        "SAME_AUDIT_TARGET",
        "SUCCESSFUL_EXECUTION_STATE",
        "EVIDENCE_REFERENCE_PRESENT",
        "EVIDENCE_GRADE_ALLOWED",
        "VALUE_TYPE_MATCH",
        "METHOD_PRESENT",
        "LIMITATION_PRESENT",
        "AUTHORIZED_CONTROL_BASIS",
        "AUTHORIZED_PRODUCT_STATUS",
        "AUTHORIZED_SCORE_ANCHOR",
        "THRESHOLD_SOURCE_WHEN_REQUIRED",
        "NO_CONFLICTING_EVIDENCE",
        "NO_RAW_PROVIDER_PAYLOAD"
      ],
      "non_execution_reason_codes": [
        "EVIDENCE_UNAVAILABLE",
        "EXECUTION_ERROR",
        "EVIDENCE_CONFLICT",
        "TARGET_MISMATCH",
        "NOT_APPLICABLE",
        "THRESHOLD_SOURCE_MISSING",
        "EVIDENCE_GRADE_TOO_WEAK",
        "VALUE_TYPE_INVALID",
        "RAW_PROVIDER_EVIDENCE_REJECTED"
      ],
      "control_basis": "PUBLIC_SEARCH_SAMPLE"
    },
    {
      "metric_id": "FIND-05",
      "category": "findability_seo",
      "metric_weight": 15,
      "category_weight": 25,
      "score_mode": "search_sample",
      "allowed_score_statuses": [
        "strong",
        "minor_gaps",
        "mixed",
        "weak",
        "blocking"
      ],
      "threshold_source_required": false,
      "defined_test_method": "Run at least three dated non-brand intent queries relevant to visible offer/market.",
      "capability_id": "search_sample",
      "source_family": "SEARCH_INDEXING_SERP",
      "accepted_source_families": [
        "SEARCH_INDEXING_SERP"
      ],
      "required_evidence": {
        "scoreable_execution_states": [
          "OBSERVED"
        ],
        "minimum_evidence_refs": 1,
        "missing_evidence_behavior": "NOT_SCORE_ADMITTED"
      },
      "maximum_evidence_grade": "E5",
      "expected_value_type": "object",
      "target_binding_policy": "SAME_AUDIT_TARGET",
      "normalization_path": "CORE_EXECUTION_BUNDLE_V1_TO_DIAGNOSIS_METRIC",
      "score_admission_requirements": [
        "AUTHORIZED_METRIC_ID",
        "SAME_AUDIT_TARGET",
        "SUCCESSFUL_EXECUTION_STATE",
        "EVIDENCE_REFERENCE_PRESENT",
        "EVIDENCE_GRADE_ALLOWED",
        "VALUE_TYPE_MATCH",
        "METHOD_PRESENT",
        "LIMITATION_PRESENT",
        "AUTHORIZED_CONTROL_BASIS",
        "AUTHORIZED_PRODUCT_STATUS",
        "AUTHORIZED_SCORE_ANCHOR",
        "THRESHOLD_SOURCE_WHEN_REQUIRED",
        "NO_CONFLICTING_EVIDENCE",
        "NO_RAW_PROVIDER_PAYLOAD"
      ],
      "non_execution_reason_codes": [
        "EVIDENCE_UNAVAILABLE",
        "EXECUTION_ERROR",
        "EVIDENCE_CONFLICT",
        "TARGET_MISMATCH",
        "NOT_APPLICABLE",
        "THRESHOLD_SOURCE_MISSING",
        "EVIDENCE_GRADE_TOO_WEAK",
        "VALUE_TYPE_INVALID",
        "RAW_PROVIDER_EVIDENCE_REJECTED"